ticker,time_published,title,url,source,source_domain,summary,authors,topic_names,topic_relevance_mean,overall_sentiment_score,overall_sentiment_label,ticker_relevance_score,ticker_sentiment_score,ticker_sentiment_label
SPY,2015-02-10 09:36:31+00:00,"Ray Dalio's Bridgewater picks up chunk of Microsoft, ditches UPS",https://www.investmentnews.com/equities/ray-dalios-bridgewater-picks-up-chunk-of-microsoft-ditches-ups/60966,InvestmentNews,InvestmentNews,"Ray Dalio's Bridgewater Associates significantly increased its stake in Microsoft Corp. while divesting its holdings in SPDR S&P 500 ETF Trust and United Parcel Service Inc. during the last quarter. The hedge fund, despite seeing its equity holdings decline in value, still outperformed most peers in January with an 8.3% gain, managing $160 billion in assets. These portfolio changes were detailed in a recent SEC filing.",Bloomberg,financial_markets|finance|economy_macro|technology|energy_transportation,0.7445672,-0.140483,Neutral,0.906162,0.147022,Neutral
SPY,2015-05-29 06:01:00+00:00,Opinion: ETFs for ‘growth’ and ‘value’ stocks can trip up investors,https://www.marketwatch.com/story/etfs-for-growth-and-value-stocks-can-trip-up-investors-2015-05-29?gaa_at=eafs&gaa_n=AWEtsqf8DD_g-5MiOi8CQgLjEB3EE_s5AgrwAUpwtURkc6gP1icglnhV3ZmK&gaa_ts=69087ac6&gaa_sig=zus6Rb02vmTdpIBX4oMUvbyL3VemjrodXuXGqAmq0pFOXCA8Kq__5fn8i5-p3RdAkSvIPZJBYVdw7sPinEgB_g%3D%3D,MarketWatch,MarketWatch,"This article discusses the challenges investors face with ""growth"" and ""value"" stock classifications when using ETFs. The author argues that despite these being common investment labels, their definitions are often ambiguous and lack consensus, complicating investment decisions. This lack of clear definitions can lead to confusion and potential pitfalls for investors relying on these categories.",John Prestbo,financial_markets,0.905645,0.095108,Neutral,0.810957,0.094057,Neutral
SPY,2015-12-01 09:36:31+00:00,This new ETF tracks the green version of the S&P 500,https://www.investmentnews.com/equities/this-new-etf-tracks-the-green-version-of-the-sp-500/65501,InvestmentNews,InvestmentNews,"A new ETF, the SPDR S&P 500 Fossil Fuel Free ETF (SPYX), has been launched to offer a greener version of the traditional S&P 500. This ETF removes companies with fossil fuel reserves from the S&P 500, significantly reducing its energy sector exposure compared to the SPDR S&P 500 ETF Trust (SPY). While not entirely carbon-free, SPYX offers investors a lower-carbon footprint option for broad market exposure.",Bloomberg,financial_markets|energy_transportation,0.8812504999999999,0.1905,Somewhat-Bullish,1.0,0.250468,Somewhat-Bullish
SPY,2017-11-01 13:15:00+00:00,A new ETF tries turning market-cap weighting on its head,https://www.marketwatch.com/story/a-new-etf-tries-turning-market-cap-weighting-on-its-head-2017-11-01?gaa_at=eafs&gaa_n=AWEtsqdr9UjZ0AfuKMK5i8eGRq0HYzmDkXEUVZvfWc9U4SgAy87WIwSYwQGq&gaa_ts=69084150&gaa_sig=6_g81P5NpYEcxmnd7X-pex8txuXs7KTk61muy35mbtYerLZbVXJUofiAsiCra92DiDBHEDW_mJtMeqRvg8oACQ%3D%3D,MarketWatch,MarketWatch,"A new exchange-traded fund, the Reverse Cap Weighted US Large Cap ETF, is challenging traditional market-cap weighting by inversing the proportions of its S&P 500 components. This means that while Apple is the largest stock in the benchmark index, it will be the smallest component in this new fund, launching on Wednesday. The fund aims to flip the time-tested approach of passive investments that typically rank stocks by size.",,financial_markets|finance,0.8325015,0.103526,Neutral,0.720067,-0.108922,Neutral
SPY,2017-12-07 14:48:00+00:00,"Bitcoin’s surge over $15,000 makes it bigger than all but 12 S&P 500 components",https://www.marketwatch.com/story/bitcoins-surge-makes-it-bigger-than-these-iconic-companies-2017-11-27?gaa_at=eafs&gaa_n=AWEtsqftdn-d5ItMA77sxVnMXa4GsZ7gOwRYSLV4y0nKW3XIVXNpUbYV0UfA&gaa_ts=69084150&gaa_sig=rOfBEuUbo5p8A8aJiQu4qX3-jdD48CYEetnAjoZ4mt2ng3jYlll93Bv3WziNTlImsJ-w_cRyfvY0ytle0PUTEQ%3D%3D,MarketWatch,MarketWatch,"Bitcoin's market capitalization has grown to exceed that of all but 12 S&P 500 companies, including major bellwethers like Visa, Procter & Gamble, and Chevron. This surge is attributed to its massive price appreciation, which saw it climb over 1,400% in 2017 and break through the $15,000 mark. The digital currency's rapid growth positions it as larger than many established and well-known global brands.",,blockchain|financial_markets|economy_macro,0.7886636666666668,0.195643,Somewhat-Bullish,0.912318,0.31282,Somewhat-Bullish
SPY,2018-03-14 08:25:00+00:00,"S&P 500’s new mini-uptrend give bears more reason to be nervous, charts suggest",https://www.marketwatch.com/story/sp-500s-new-mini-uptrend-give-bears-more-reason-to-be-nervous-charts-suggest-2018-03-13?gaa_at=eafs&gaa_n=AWEtsqcs8AHmfCcntz_gxYdznpFu94O_lgCFbWwIkOCPb6p5KC3xtbuaGa5Q&gaa_ts=6908241c&gaa_sig=UaxJagDOWUDHshUK2hNB7g6HnNIPekIoFhZ40-xPEmxlmk0PVo7kBC-KV85sjFEVyCOcZua5aLV91Qjcsa8Tew%3D%3D,MarketWatch,MarketWatch,"The S&P 500's recent movements, characterized by higher lows and higher highs, suggest the start of a new mini-uptrend. This pattern, observed through technical analysis, implies that the broader nine-year bull market is still intact. Consequently, charts indicate that market bears should be more concerned about the current market trajectory.",,financial_markets,0.902089,0.265796,Somewhat-Bullish,0.348868,0.043264,Neutral
SPY,2018-04-23 08:42:00+00:00,"SPY Chart, Investor Sentiment Echo November 2016 Stock Market",https://www.schaeffersresearch.com/content/analysis/2018/04/23/spy-chart-investor-sentiment-echo-november-2016-stock-market,Schaeffer's Investment Research,Schaeffer's Investment Research,"The article discusses the stock market's resistance at key technical levels and the lingering influence of FOMC rate hikes. It highlights how current investor sentiment, specifically low equity allocations and technical indicators, echoes the pre-November 2016 election period. The author suggests that a resolution to trade war concerns, similar to the removal of election uncertainty in 2016, may be needed to push the S&P 500 above resistance.",Todd Salamone,financial_markets|economy_monetary|earnings|economy_macro,0.76787225,-0.213693,Somewhat-Bearish,1.0,-0.235726,Somewhat-Bearish
SPY,2019-03-15 09:13:00+00:00,"If you’re tracking the S&P 500 instead of this fund, you’re leaving money on the table",https://www.marketwatch.com/story/if-youre-tracking-the-sp-500-instead-of-this-fund-youre-leaving-money-on-the-table-2019-03-13?gaa_at=eafs&gaa_n=AWEtsqcLhmlUZjs0Oy8Cq43yweAyma_LaU2xbYMt4WcrYoX-mlmdEO2SjEYG&gaa_ts=690806ed&gaa_sig=sNl8QRDH99I-IyiAcvfSQLFrBLDYaNyFySDMNE4BEtNP1iBbPBMyjHq3Z_1pML-68AAZL0hL01Z-LeTV7nQE5Q%3D%3D,MarketWatch,MarketWatch,"The article suggests that investors tracking the S&P 500 might be missing out on better performance by not considering the Invesco QQQ Trust. It highlights QQQ as a successful and diversified alternative, noting that even with ""FAANG"" company dominance, valuations are lower than during the dot-com bubble. The piece advocates for diversification beyond traditional S&P 500 index funds for retirement savers.",,financial_markets|technology,0.8725645,0.190219,Somewhat-Bullish,1.0,0.294594,Somewhat-Bullish
SPY,2019-05-01 11:42:00+00:00,"SPY ETF Breaks New All-Time High, Up Over 18% YTD",https://www.etftrends.com/equity-etf-channel/spy-etf-breaks-new-all-time-high-up-over-18-ytd/,ETF Trends,ETF Trends,"The SPDR S&P 500 ETF (SPY) reached a new all-time high of $294.78, up over 18% year-to-date, driven by strong U.S. equities and better-than-expected Q1 GDP numbers. The article highlights SPY's enduring popularity and significant inflows into ETFs compared to mutual funds, reflecting resilient investor sentiment despite past market challenges. It also details the key features of SPY and its top holdings.",Ben Hernandez,financial_markets|economy_macro,0.89664,0.032778,Neutral,0.309341,0.041958,Neutral
SPY,2019-11-22 00:00:00+00:00,SPDR chairman and industry pioneer Jim Ross to retire,https://www.etfstream.com/articles/spdr-chairman-and-industry-pioneer-jim-ross-to-retire,ETF Stream,ETF Stream,"Jim Ross, an industry pioneer who helped launch the first ETFs including the SPDR S&P 500 ETF Trust (SPY), is retiring as chairman of the global SPDR ETFs business after 27 years with State Street Global Advisors. Ross, who led SPDR's ETF business since 2005 and became chairman in 2016, will retire in March 2020. His contributions were lauded by State Street CEO Ron O’Hanley as instrumental to one of the most important product innovations in the investment management industry.",Tom Eckett,finance,0.847568,0.1064,Neutral,1.0,0.135097,Neutral
SPY,2020-02-27 23:21:30+00:00,ETF of the Week: SPDR Portfolio S&P 500 ETF (SPLG),https://www.etftrends.com/multi-asset-channel/etf-of-the-week-spdr-portfolio-sp-500-etf-splg/,ETF Trends,ETF Trends,"This article discusses the SPDR Portfolio S&P 500 ETF (SPLG) as a cheaper, more modernized alternative to the flagship SPDR S&P 500 ETF Trust (SPY). ETF Trends CEO Tom Lydon highlights SPLG's advantages for long-term investors, including a lower expense ratio and a more flexible structure compared to SPY's unit investment trust setup. The article notes SPLG's growing traction with $700 million in net inflows for the week ended February 21, 2020.",Aaron Neuwirth,financial_markets|finance,0.884819,-0.256197,Somewhat-Bearish,1.0,-0.269395,Somewhat-Bearish
SPY,2020-10-24 09:19:00+00:00,How to invest in the S&P 500 without betting hard on the ‘FAAMG’ stocks that are 20% of the index,https://www.marketwatch.com/story/how-to-invest-in-the-sp-500-without-betting-on-faamg-stocks-2020-10-23?gaa_at=eafs&gaa_n=AWEtsqcVe5OvxafNY1tih3paw4PGK5Lt9VOIG40RIBMeU60E8b9NnM-5J_EM&gaa_ts=6907eaa8&gaa_sig=oRNV3Myd3V_ABsYnni4y6Ko0cX3hfaY-XjIqNQhDdmOMiCLTkEM__rHXR6_zwaunwL1G9xdJfMFTWrCmsBSkIA%3D%3D,MarketWatch,MarketWatch,"This article discusses how to invest in the S&P 500 without heavily relying on the ""FAAMG"" stocks (Facebook, Apple, Amazon.com, Microsoft, and Google/Alphabet), which represent a significant portion of the index's valuation. It suggests that when investing in a standard S&P 500 index fund, one is implicitly making a large bet on the continued success of these five tech giants. The article hints at an alternative strategy, specifically mentioning an ""Equal-weight S&P 500 ETF,"" for investors looking to diversify away from the concentrated influence of FAAMG stocks within the S&P 500.",,financial_markets,0.905594,0.286151,Somewhat-Bullish,1.0,0.275588,Somewhat-Bullish
SPY,2020-11-24 03:52:05+00:00,"Dow pulls back more than 150 points after reaching 30,000 milestone",https://www.cnbc.com/2020/11/24/stock-market-futures-open-to-close-news.html,CNBC,CNBC,"The Dow Jones Industrial Average fell on Wednesday, pulling back after reaching the 30,000 milestone the previous day, amidst disappointing unemployment data. The S&P 500 dipped while the Nasdaq Composite rose, and trading volumes were lighter ahead of Thanksgiving. Salesforce led the Dow lower on news of its potential acquisition of Slack, while positive vaccine news and political clarity had previously fueled market rallies.",Fred Imbert,financial_markets|economy_macro|life_sciences|economy_monetary|mergers_and_acquisitions,0.723637,-0.142793,Neutral,1.0,-0.129013,Neutral
SPY,2020-12-04 02:55:14+00:00,S&P 500 Approaching Elliott Wave 5 Top,https://www.seeitmarket.com/sp-500-approaching-elliott-wave-5-top/,See It Market,See It Market,"The article suggests the S&P 500 is nearing a potential long-term top based on Elliott Wave analysis, with major U.S. indices showing possibly completed upward patterns. Investors are advised to rebalance portfolios defensively, and traders should recognize higher risk for bullish positions. While a major correction could start soon, the authors caution against premature bearishness, noting an alternative wave count that could lead to further gains.",T. Pizzuti and K. Hulse,financial_markets|economy_macro,0.7790874999999999,-0.386178,Bearish,1.0,-0.404018,Bearish
SPY,2021-01-17 21:17:20+00:00,"SPY - Ssga Active Trust - Spdr S&p 500 Etf Trust Quote, Price, Charts & News",https://www.cmlviz.com/stocks/SPY/summary,CMLviz,CMLviz,"This page provides real-time quote, price, charts, and news for the SPDR S&P 500 ETF Trust (SPY), managed by SSgA Active Trust. It displays current market data for SPY, along with major indices like SPX, Dow 30, QQQ, and VIX. The content appears to be a tear sheet or summary page for the SPY ETF from CMLViz.com.",,financial_markets,0.91454,0.359524,Bullish,1.0,0.343587,Somewhat-Bullish
SPY,2021-05-25 17:28:00+00:00,Bets Against $357 Billion S&P 500 ETF Jump to Highest This Year,https://www.bloomberg.com/news/articles/2021-05-25/bets-against-357-billion-s-p-500-etf-jump-to-highest-this-year,Bloomberg.com,Bloomberg.com,"Investors are increasing their bets against the S&P 500 by shorting the SPDR S&P 500 ETF Trust (SPY). Short interest in the $357 billion ETF has reached its highest level this year, even as the S&P 500 fluctuates near its all-time high.",Sam Potter and Kamaron Leach,financial_markets,0.941659,-0.240405,Somewhat-Bearish,1.0,-0.236608,Somewhat-Bearish
SPY,2021-05-25 18:06:00+00:00,"S&P 500 ekes out a small gain in light trading, boosted by reopening plays",https://www.cnbc.com/2021/05/25/stock-market-futures-open-to-close-newshtml.html,CNBC,CNBC,"U.S. stocks saw slight gains, with the S&P 500 climbing 0.2% driven by companies linked to economic reopening, such as Carnival and Royal Caribbean. Ford's increased investment in electric vehicles also boosted its shares, while Bitcoin's comeback contributed to positive risk sentiment. Trading was light ahead of the Memorial Day weekend, as investors also watched for developments on an infrastructure bill and major bank testimonies.",Yun Li|Hannah Miao,financial_markets|economy_macro|earnings|blockchain|retail_wholesale,0.7397906,0.355033,Bullish,1.0,0.223851,Somewhat-Bullish
SPY,2021-06-16 21:17:20+00:00,S&P 500 warning signals start flashing as ETF short bets build,https://www.etfstream.com/articles/sp-500-warning-signals-start-flashing-as-etf-short-bets-build,ETF Stream,ETF Stream,"Concerns are rising for a potential S&P 500 market correction, evidenced by increased short positions against the SPDR S&P 500 ETF Trust (SPY) and negative S&P 500 constituent earnings minus inflation. The SKEW index hitting record highs also suggests investors are paying a premium for protection against large market drawdowns. While some indicators point to caution, analysts suggest that improving economic conditions and strong earnings expectations could continue to support valuations, with any dips likely to be bought.",Jamie Gordon,financial_markets|economy_monetary|economy_macro,0.8429923333333335,0.040425,Neutral,0.300465,0.048322,Neutral
SPY,2021-08-13 14:27:00+00:00,Indicator That Signaled Corrections In 2010 And 2018 Flashes Red Again: Marshallian K Shows Liquidity Evaporating.,https://www.benzinga.com/21/08/22492938/indicator-that-signaled-corrections-in-2010-and-2018-flashes-red-again-marshallian-k-shows-liquidity,Benzinga,Benzinga,"The Marshallian K indicator, which measures market liquidity, has turned negative again, a signal that previously preceded market corrections in 2010 and 2018. While elevated market valuations increase the risk, the article notes that correction predictions often outnumber actual corrections. It suggests adding downside protection, such as hedging with SPY options, as a precautionary measure given the current inexpensive cost of hedging market risk.",David Pinsen,financial_markets|economy_macro,0.873378,-0.293061,Somewhat-Bearish,1.0,-0.254091,Somewhat-Bearish
SPY,2021-09-14 19:18:09+00:00,Satisfying the ever-evolving demands of the the semiconductor industry,https://www.theworldfolio.com/news/satisfying-the-evere/4487/,The Worldfolio,The Worldfolio,"Yamaha Robotics Holdings (YRH) serves as a one-stop smart solution provider in the semiconductor industry, operating in back-end semiconductor manufacturing, surface mount technology (SMT), and factory automation. As demand for semiconductors grows with Industry 4.0, YRH leverages Japan's expertise in ""integral manufacturing"" and its significant investments in advanced technologies to meet the market's evolving needs. The company aims to become the number one one-stop smart solution provider globally within three years, particularly strengthening its position in European SMT sales and utilizing its strong presence in the automotive inspection market.",,manufacturing|technology,0.972426,0.314956,Somewhat-Bullish,0.556825,0.284726,Somewhat-Bullish
SPY,2021-10-01 18:27:20+00:00,Fourier: Interpreting and Over-interpreting Frequency Analysis for AMEX:SPY by tbtkg,https://www.tradingview.com/chart/SPY/Zfsm6LDg-Fourier-Interpreting-and-Over-interpreting-Frequency-Analysis/,TradingView,TradingView,"This article explores the application of Fourier transform for frequency analysis of financial data, using an artificial price dataset for demonstration. It discusses the capabilities and limitations of the Fast Fourier Transform (FFT) algorithm in identifying periodicity, discontinuities, and random walks within price data. The author concludes that while Fourier analysis is a powerful mathematical tool, its utility in capitalizing on market cycles in financial time series is questionable, though it could be generally useful for price data analysis.",tbtkg,financial_markets,0.900971,0.143737,Neutral,1.0,0.105745,Neutral
SPY,2021-11-29 17:35:01+00:00,How to Automate Your Stock and ETF Trading Strategies for AMEX:SPY by TradeAutomation,https://www.tradingview.com/chart/SPY/cqBhOlym-How-to-Automate-Your-Stock-and-ETF-Trading-Strategies/,TradingView,TradingView,"This article provides an overview of how retail investors can automate stock and ETF trading strategies using TradingView alerts and Interactive Brokers. It outlines a process that involves setting up an AWS RDP server, installing IB Gateway and TradeRelay software, coding strategies in PineScript, and configuring webhooks for alerts. The author emphasizes that this method requires minimal coding expertise for the user.",TradeAutomation,financial_markets|technology,0.8746700000000001,0.209816,Somewhat-Bullish,1.0,0.238399,Somewhat-Bullish
SPY,2022-02-10 10:27:00+00:00,SPY Stock: SPDR S&P 500 ETF Trust Is a Stock to Hold Onto Forever,https://investorplace.com/2022/02/spy-stock-is-a-stock-to-hold-on-forever/,InvestorPlace,InvestorPlace,"Despite a volatile start to the year and concerns about a potential recession, the article argues that the SPDR S&P 500 ETF Trust (SPY) remains a strong long-term investment. It highlights the ETF's consistent performance, exposure to top U.S. companies, and low expense ratio as reasons to overlook current bearish sentiment. The author believes that while the market may experience short-term wobbles, a crippling long-term recession is unlikely, making SPY a reliable choice for investors.",Muslim Farooque,financial_markets|economy_monetary|economy_macro,0.8068863333333334,0.36385,Bullish,1.0,0.388792,Bullish
SPY,2022-03-21 14:05:15+00:00,SPY Stock: Today the SPDR S&P 500 ETF Is a Certain Buy,https://investorplace.com/2022/03/spy-stock-today-the-spdr-sp-500-etf-is-a-certain-buy/,InvestorPlace,InvestorPlace,"The article argues that the SPDR S&P 500 ETF (SPY) is a good buy, despite recent market volatility and corrections. It highlights SPY's strong rally the previous week, suggesting that market uncertainty is diminishing. The author recommends buying SPY to gain market exposure at an attractive discount, citing factors like the Federal Reserve's ""nimble"" approach to inflation, global COVID-19 management, and historical trends of geopolitical events creating buying opportunities.",Chris Tyler,financial_markets|economy_monetary|economy_macro,0.8377243333333334,0.535981,Bullish,1.0,0.549709,Bullish
SPY,2022-03-25 19:51:00+00:00,The SPY ETF Is an Attractive Long-Term Option to Buy in April,https://investorplace.com/2022/03/spy-stock-offers-an-attractive-long-term-option-for-april/,InvestorPlace,InvestorPlace,"The SPDR S&P 500 ETF Trust (SPY) has seen an 8% decline since January but is up almost 5% in the last month, tracking broader market swings. The author suggests this dip, along with the recent interest rate hike, creates a good entry point for long-term investors. SPY, which tracks the S&P 500 and is the oldest and largest ETF in the US, offers diversified access to major companies, making it a reliable long-term investment despite potential short-term volatility.",Tezcan Gecgil,financial_markets|economy_monetary|economy_macro,0.8135886666666666,0.37769,Bullish,1.0,0.463706,Bullish
SPY,2022-03-29 14:05:15+00:00,SPY Stock Is a Safe Investment During Times of Volatility,https://investorplace.com/2022/03/spy-stock-is-a-safe-investment-during-times-of-volatility/,InvestorPlace,InvestorPlace,"The article suggests that SPDR S&P 500 ETF Trust (SPY) stock is a safe investment during volatile market conditions due to its diversification and exposure to large-cap U.S. equities. It highlights SPY's historical outperformance, dividend payments, and minimal management requirements, making it suitable for risk-averse investors seeking a buy-and-hold option. While acknowledging some downsides like holding laggards and higher expense ratios compared to some alternatives, the article concludes that SPY remains a reliable, low-risk investment.",Faizan Farooque,financial_markets|economy_macro,0.817381,0.490812,Bullish,1.0,0.498377,Bullish
SPY,2022-03-29 14:05:15+00:00,Curb Your Bearish Enthusiasm and Invest in SPY Stock,https://investorplace.com/2022/03/curb-your-bearish-enthusiasm-and-invest-in-spy-stock/,InvestorPlace,InvestorPlace,"Despite market weakness and macroeconomic challenges in 2022, the article argues that the SPDR S&P 500 ETF Trust (SPY) remains an attractive investment. Citing its low expense ratio, exposure to major U.S. companies, and historical resilience, the author suggests SPY stock offers substantial upside potential and protection against downside risks, echoing advice from investors like Warren Buffett. The S&P 500 has consistently recovered from past crashes and provided positive long-term growth.",Muslim Farooque,financial_markets|economy_macro|economy_monetary,0.765774,0.499364,Bullish,1.0,0.460618,Bullish
SPY,2022-04-13 11:48:00+00:00,SPY Stock: Earnings and Key Support Are in Play for SPY ETF,https://investorplace.com/2022/04/earnings-and-key-support-are-in-play-for-spy-etf/,InvestorPlace,InvestorPlace,"The article discusses the SPDR S&P 500 ETF (SPY) amidst bearish macro drivers, focusing on the upcoming earnings season and key technical support levels. It highlights how investor sentiment is influenced by corporate health reports from SPY constituents like JPMorgan Chase & Co and Delta Airlines, alongside technical indicators such as the 50% Fibonacci retracement and the Chicago Board Options Exchange Volatility Index, to assess potential market bottoms.",Chris Tyler,earnings|financial_markets|economy_monetary|economy_macro,0.79891375,-0.011336,Neutral,1.0,-0.147489,Neutral
SPY,2022-04-18 11:58:00+00:00,Why the Immense Selling Pressure on the SPY ETF Must End,https://investorplace.com/2022/04/why-the-immense-selling-pressure-on-the-spy-etf-must-end/,InvestorPlace,InvestorPlace,"The article discusses why the intense selling pressure on the SPDR S&P 500 ETF Trust (SPY) is likely to subside, presenting a buying opportunity. It attributes recent declines to concerns surrounding major holdings like Microsoft, Amazon, and Tesla, including antitrust reviews, Rivian losses, and Elon Musk's distraction with Twitter. Despite these issues, the author argues that the fundamental strength of the top companies in the S&P 500 remains, and investors should accumulate SPY shares on dips.",Chris Lau,financial_markets,0.918103,-0.194768,Somewhat-Bearish,1.0,0.314827,Somewhat-Bullish
SPY,2022-06-02 08:00:00+00:00,Analyzing the SPY's Recent Options Volume,https://www.schaeffersresearch.com/content/analysis/2022/06/02/analyzing-the-spys-recent-options-volume,Schaeffer's Investment Research,Schaeffer's Investment Research,"This article analyzes recent options volume for the SPDR S&P 500 ETF Trust (SPY), examining the behavior of put and call options since the COVID-19 pandemic. It highlights a general increase in options volume, particularly calls relative to puts, and a significant shortening of option timeframes. The analysis also reveals a dramatic fall in the typical call option delta, possibly indicating increased retail trader activity or speculation on a market snap-back rally.",Rocky White,financial_markets|economy_macro,0.757475,0.254532,Somewhat-Bullish,1.0,0.033851,Neutral
SPY,2022-06-03 18:46:10+00:00,The SPDR S&P 500 ETF Trust Is Still Overvalued,https://news.yahoo.com/spdr-p-500-etf-trust-121541783.html,Yahoo News,Yahoo News,"The author argues that the recent surge in the SPDR S&P 500 ETF Trust (SPY) is premature because the S&P 500 remains overvalued. Utilizing the Fed Valuation Model and considering sector weightings, the article suggests that key metrics are not aligned for sustained index success in the near term, anticipating a plateau rather than a continued recovery. Divergent analyst opinions and a low VIX further support the uncertainty in the market.",Steve Booyens,financial_markets|economy_monetary|economy_macro,0.8227403333333333,-0.169585,Somewhat-Bearish,0.974834,-0.312363,Somewhat-Bearish
