ticker,time_published,title,url,source,source_domain,summary,authors,topic_names,topic_relevance_mean,overall_sentiment_score,overall_sentiment_label,ticker_relevance_score,ticker_sentiment_score,ticker_sentiment_label
SPY,2022-08-30 09:38:47+00:00,The S&P 500 Just Flashed A Significant Signal,https://www.valuewalk.com/the-sp-500-just-flashed-a-significant-signal/,ValueWalk,ValueWalk,"The S&P 500 has flashed a significant negative signal by confirming resistance in the 4,100-4,300 range, forming a Head & Shoulders Reversal Pattern. This indicates a potential for at least 4 to 12 months of selling. Several headwinds, including a strong dollar, contraction in the housing sector, aggressive interest rate hikes from the FOMC, and a declining earnings outlook with shrinking margins, are contributing to this bearish forecast.",MarketBeat Editor,financial_markets|economy_monetary|economy_macro|real_estate|earnings,0.8405712,0.000897,Neutral,0.331929,0.042114,Neutral
SPY,2022-09-06 08:38:28+00:00,Lightweight parts for the EV revolution,https://www.theworldfolio.com/news/lightweight-parts-fo/4509/,The Worldfolio,The Worldfolio,"Akashi-Kikai, a Japanese manufacturer and Daihatsu subsidiary, is leveraging its expertise in lightweight, cost-effective vehicle parts for the electric vehicle (EV) revolution and construction industry. The company, founded in 1946, has developed a five-year plan to adapt to new market demands, focusing on high-performance noiseless gears and camshafts with applications in both automotive and construction machinery. Akashi-Kikai emphasizes human resource development and has expanded into Indonesian and Malaysian markets through joint ventures.",,manufacturing|energy_transportation|technology,0.784224,0.183771,Somewhat-Bullish,0.311663,0.004797,Neutral
SPY,2022-10-17 07:41:47+00:00,Price Correction to fix data manipulation and mispricing — Indicator by Techotomy,https://www.tradingview.com/script/RGa1yeCB-Price-Correction-to-fix-data-manipulation-and-mispricing/,TradingView,TradingView,"This article introduces the ""Price Correction"" indicator by Techotomy, designed to rectify data manipulation and mispricing issues in financial charts on TradingView. It highlights specific instances of mispricing in the SPY ETF and the NYSE Composite Index (NYA) by the AMEX exchange and NYSE, respectively, explaining how these inconsistencies are addressed. The indicator aims to provide accurate financial data by correcting daily and intraday OHLC data based on actual price action, offering a tool for traders to ensure reliable charting.",,financial_markets|technology|finance,0.8176676666666666,0.104646,Neutral,1.0,0.147928,Neutral
SPY,2022-10-26 07:41:47+00:00,Where 5 Wall Street Analysts Think the SPY ETF Will Go in 2023,https://investorplace.com/2022/10/where-5-wall-street-analysts-think-the-spy-etf-will-go-in-2023/,InvestorPlace,InvestorPlace,"This article compiles the 2023 price predictions for the SPDR S&P 500 ETF (SPY) from five Wall Street analysts. With the SPY ETF down significantly year-to-date due to rising interest rates, analysts from Morgan Stanley, Citi, Goldman Sachs, Credit Suisse, and UBS offer varied price targets for the coming year. These predictions range from around $389 to $419, reflecting mixed expectations for the S&P 500's performance.",Chris MacDonald,financial_markets|economy_monetary|economy_macro|finance,0.781566,0.131359,Neutral,1.0,0.073302,Neutral
SPY,2022-11-24 06:45:06+00:00,SWCC: Providing next-generation power infrastructure,https://www.theworldfolio.com/news/swcc-providing-nextgeneration-power-infrastructure-/4556/,The Worldfolio,The Worldfolio,"SWCC, a Japanese manufacturer of electric wires and cables, is addressing the critical need for advanced power infrastructure. The company's e-Ribbon® optical fiber cables are designed for high-capacity communication and efficient installation in data centers, which are crucial for the global digital revolution. SWCC is also adapting its innovative technology for the automotive sector's transition to electric vehicles.",,manufacturing|technology|energy_transportation,0.8271130000000001,0.264665,Somewhat-Bullish,0.586457,0.268765,Somewhat-Bullish
SPY,2022-12-08 05:48:17+00:00,Driving innovation in fabric and fibers,https://www.theworldfolio.com/news/driving-innovation-in-fabric-and-fibers/4564/,The Worldfolio,The Worldfolio,"Komatsu Matere, a Japanese fabric manufacturer, excels in the global market through continuous R&D and unique chemical fabric manufacturing technologies. The company's commitment to innovation has led to the development of ""ultra components"" utilized by leading fashion brands and world-class athletes, as well as expansions into construction materials like Greenbiz and anti-seismic solutions with CABKOMA technology. Komatsu Matere also innovated in personal protective equipment, creating a comfortable face mask during the Covid-19 pandemic, all while adhering to its philosophy of freshness in every action.",,manufacturing|technology|real_estate|retail_wholesale,0.69005975,0.271208,Somewhat-Bullish,0.59047,0.29103,Somewhat-Bullish
SPY,2022-12-08 10:04:00+00:00,This fund beats the S&P 500 by using 75 of its stocks. Here's how it works.,https://www.marketwatch.com/story/this-fund-beats-the-s-p-500-by-using-just-75-of-its-components-heres-how-it-works-11670511856?gaa_at=eafs&gaa_n=AWEtsqdnyTtXSOqGonpri0-6k-EfvpPt-CAjaXoz5Nlw0JTLzd0Kk9POwWV6&gaa_ts=6907aa1e&gaa_sig=71hbWPFnvWjnsxP3mYFC-HrJnzTYd2w5XmmfRRmicZn9sMabZdkA9kMgnB3K52t_lYLUkXBGw_QV3_99DSy3qQ%3D%3D,MarketWatch,MarketWatch,"This article discusses how the Invesco S&P 500 GARP ETF has managed to outperform the S&P 500 by focusing on only 75 of its components. The fund's success is attributed to its investment strategy which combines quality and lower prices, proving effective in both bull and bear markets. This approach might be particularly appealing to investors concerned about a potential recession.",Philip van Doorn,financial_markets|finance|economy_macro,0.7625730000000001,0.284176,Somewhat-Bullish,1.0,0.337673,Somewhat-Bullish
SPY,2022-12-21 05:48:17+00:00,Ken Griffin among world’s richest after stellar year for Citadel,https://www.cmcmarkets.com/en-au/opto-partners/ken-griffin-among-worlds-richest-after-stellar-year-for-citadel,CMC Markets,CMC Markets,"Ken Griffin, CEO of Citadel, has joined the ranks of the world's top 40 wealthiest individuals following an exceptional year for his hedge fund, with its flagship Wellington fund returning 32%. This success comes despite a challenging market for other financial institutions and amid accusations of market manipulation (""spoofing"") by biotech firm Northwest Biotherapeutics, which Citadel firmly denies. The firm's performance was reportedly boosted by strategic trading of S&P 500 options.",OPTO,financial_markets|earnings|finance|economy_macro|life_sciences,0.743888,0.178848,Somewhat-Bullish,0.991152,0.279569,Somewhat-Bullish
SPY,2022-12-22 18:46:10+00:00,ETF pioneer Kathleen Moriarty dies at 69,https://www.investmentnews.com/etfs/etf-pioneer-kathleen-moriarty-dies-at-69/232218,InvestmentNews,InvestmentNews,"Kathleen Moriarty, a prominent lawyer instrumental in the creation of the first exchange-traded fund, the SPDR S&P 500 ETF Trust, has died at 69. Known as ""SPDR Woman,"" she was a pioneer in the ETF industry, guiding numerous innovative products to market and representing clients in groundbreaking ventures like the first Bitcoin ETF application. Her colleagues remember her as a humble, kind-hearted, and impactful figure who shaped the fastest-growing segment of the money-management industry.",Bloomberg,finance|financial_markets|technology|blockchain,0.801766,0.37291,Bullish,1.0,0.443933,Bullish
SPY,2022-12-26 05:48:17+00:00,"MORINAGA & CO., LTD",https://www.theworldfolio.com/company/morinaga--co-ltd/1399/,The Worldfolio,The Worldfolio,"Morinaga & Co., Ltd. is a Japanese confectionery company founded in 1899, aiming to provide delicious, fun, and healthy food products globally. The company focuses on confectioneries, foodstuffs, frozen desserts, and health-related items, with a strategic expansion into overseas markets and health segments. Despite anticipating challenges in domestic snack and frozen food markets, Morinaga is committed to strengthening its business base, expanding its product offerings, and fostering open innovation to adapt to rapid market changes.",,manufacturing|retail_wholesale,0.8785425,0.040165,Neutral,0.344297,0.005545,Neutral
SPY,2022-12-30 05:48:17+00:00,2012 and the Maya World,https://www.theworldfolio.com/news/maya-world-mexico-n1/1750/,The Worldfolio,The Worldfolio,"This article discusses the widespread fascination and misunderstanding surrounding the Maya civilization's prediction for December 21, 2012. It clarifies that while the date marked the end of a long cycle in the Maya calendar, archaeologists agree it did not signify the end of the world but rather a shift in human consciousness or a new era. The piece also highlights the enduring presence and distinct cultural traditions of modern Maya peoples in Mexico.",,economy_macro|retail_wholesale|life_sciences,0.627781,0.227431,Somewhat-Bullish,0.592892,0.018243,Neutral
SPY,2022-12-30 05:48:17+00:00,Teruaki Nakatsuka,https://www.theworldfolio.com/leader/teruaki-nakatsuka/200/,The Worldfolio,The Worldfolio,"This article provides a detailed biography of Teruaki Nakatsuka, highlighting his current role as President & CEO of JATCO Ltd. since June 2014. It also outlines his professional background, including prior positions at GE Aviation, GE Japan, McKinsey & Company, Inc., and Marubeni Corporation, as well as his educational qualifications from Northwestern University and Keio University.",,manufacturing|finance|energy_transportation,0.6438256666666667,0.003819,Neutral,0.334771,0.026753,Neutral
SPY,2023-01-24 12:05:00+00:00,"A 30-year revolution: SPY opened stocks to the masses, spawning a raft of options for today's investors",https://www.marketwatch.com/story/spy-30th-anniversary-revolution-began-after-etf-launch-seemed-an-answer-to-a-question-no-one-was-asking-says-datatrek-11674579957?gaa_at=eafs&gaa_n=AWEtsqcal4cvobO3V7v5eQGQLQFljZCayUJKPIIh95wLjLDl0Ox_GkJwyWlH&gaa_ts=699a8e2a&gaa_sig=kg-oqRZAlHVfNZTeGqPFwzLlCjXM6je8mDpDhEU51r7Joxf6VHph0KXUpMtqAvJrQnZYe7tNnPnrgyzhyiKQCg%3D%3D,MarketWatch,MarketWatch,"The SPDR S&P 500 ETF Trust (SPY), established in January 1993, is celebrating its 30th anniversary. This first U.S. exchange-traded fund revolutionized investing, making it accessible to a broader audience and leading to the creation of a vast new market. The introduction of SPY marked a significant instance of disruptive innovation in the financial sector.",Christine Idzelis,financial_markets|finance,0.8332525,0.426227,Bullish,1.0,0.422435,Bullish
SPY,2023-01-25 09:46:00+00:00,Private equity may be up next for ETF innovation as State Street celebrates SPY,https://www.marketwatch.com/story/private-equity-may-be-up-next-for-etf-innovation-as-state-street-celebrates-spy-11674658023?gaa_at=eafs&gaa_n=AWEtsqcVFSpbrh5a2lZnKiDTadY7CJUN0gq3OQ9iM9od6eE9TalCI8TLxRD8&gaa_ts=699a8e2a&gaa_sig=7WQN1Rgh6ABWOtI_R_2TujcrhRHPs5F8znkSU_u2CARC1tZhFDWsE0CbJxEuA8CV40q8Pf3HU4dLl5kXlGgIzA%3D%3D,MarketWatch,MarketWatch,"State Street is exploring private equity as the next area for innovation in the exchange-traded fund (ETF) market, as the SPDR S&P 500 ETF Trust (SPY) celebrates its 30th anniversary. Sue Thompson, head of Americas distribution for SPDR ETFs at State Street Global Advisors, expressed a desire to see private equity democratized within the ETF structure. This discussion took place during a panel celebrating the SPY ETF's milestone, focusing on future ETF market innovations.",Christine Idzelis,finance|financial_markets|technology,0.7201666666666666,0.227797,Somewhat-Bullish,1.0,0.274263,Somewhat-Bullish
SPY,2023-02-09 03:49:05+00:00,Pressing ahead: AIDA ENGINEERING provides press forming solutions for sustainable industries,https://www.theworldfolio.com/news/pressing-ahead-aida-engineering-provides-press-forming-solutions-for-sustainable-industries/4583/,The Worldfolio,The Worldfolio,"AIDA ENGINEERING, a global leader in press manufacturing for over a century, is adapting its metalforming technologies to address changing market needs, particularly in sustainable industries. The company is developing solutions for electric vehicles (EVs), energy conservation, and carbon reduction, employing technologies like cold stamping to reduce emissions and advanced presses (MSP and UL series) for producing lighter components and motor cores with high precision. AIDA is focused on product development, advanced production technologies, and leveraging AI/DX to enhance customer productivity.",,manufacturing|energy_transportation|economy_macro|technology,0.74467025,0.293204,Somewhat-Bullish,0.563706,0.273259,Somewhat-Bullish
SPY,2023-02-13 03:49:05+00:00,Best Editors' Picks of 2022 for AMEX:SPY by PineCoders,https://www.tradingview.com/chart/SPY/eTOyVYgR-Best-Editors-Picks-of-2022/,TradingView,TradingView,"TradingView's PineCoders announced the ""Best Editors' Picks of 2022"" awards, highlighting four outstanding open-source Pine Script™ publications from 84 selections. These scripts, chosen by the PineCoders team, will earn their authors 50,000 TradingView coins. The initiative aims to encourage learning and sharing within the TradingView community by showcasing original and valuable scripts.",,financial_markets|technology|finance,0.758971,0.241917,Somewhat-Bullish,1.0,0.243603,Somewhat-Bullish
SPY,2023-02-17 03:49:05+00:00,Promoting shared value through rubber compounding technology,https://www.theworldfolio.com/news/promoting-shared-value-through-rubber-compounding-technology-/4596/,The Worldfolio,The Worldfolio,"Yamato Chemical, established in 1972, has grown into a leading provider of rubber products. The company aims to offer high-quality rubber products at low prices, primarily targeting the rapidly growing ASEAN market. President Hidehiro Nakamura emphasizes the importance of consistent values and vision across domestic and international operations to maintain quality and expand overseas presence.",,manufacturing|economy_macro,0.817306,0.266087,Somewhat-Bullish,0.557158,0.265892,Somewhat-Bullish
SPY,2023-03-16 02:55:50+00:00,Hightec Systems continues to grow as essential partner for semiconductor and FPD manufacturers,https://www.theworldfolio.com/news/hightec-systems-continues-to-grow-as-essential-partner-for-semiconductor-and-fpd-manufacturers-/4611/,The Worldfolio,The Worldfolio,"Hightec Systems Corporation, led by CEO Moriaki Abe, has thrived despite Japan's ""lost 30 years"" by developing a unique three-pronged business model that includes buying/selling used manufacturing equipment, offering engineering services, and importing advanced microelectromechanical systems technology. The company emphasizes long-term customer relationships and is now looking to expand its global reach into the U.S. and European markets, building on its existing business in China, South Korea, and Taiwan. Abe's persistent efforts in securing new clients and fostering customer trust have been crucial to the company's growth from three to 100 employees and $200 million in annual sales.",,manufacturing|technology|economy_macro,0.8764113333333333,0.459585,Bullish,0.337134,0.020989,Neutral
SPY,2023-03-24 02:55:50+00:00,Momotani Juntenkan: The beginning of modern Japanese cosmetics,https://www.theworldfolio.com/news/momotani-juntenkan-the-beginning-of-modern-japanese-cosmetics/4624/,The Worldfolio,The Worldfolio,"Momotani Juntenkan, established in 1885 by Masajiro Momotani, played a pivotal role in shaping the modern Japanese cosmetics industry with its original BIGANSUI product. The company's commitment to research and development, evidenced by its institutes and product innovations like MEISHOKU Cleansing Cream, led to its growth and eventual split into three entities in 1993. Current president Seiichiro Momotani continues to uphold the founding principles, emphasizing ongoing innovation and R&D capabilities.",,retail_wholesale|manufacturing,0.7784405,0.006469,Neutral,0.306611,0.020803,Neutral
SPY,2023-03-31 02:55:50+00:00,SPDR S&P 500 (SPY) Stock: Breakout Leveraging Tech Stocks Rally?,https://www.thecoinrepublic.com/2023/03/31/spdr-sp-500-spy-stock-breakout-leveraging-tech-stocks-rally/,The Coin Republic,The Coin Republic,"The SPDR S&P 500 (SPY) ETF has shown a positive resurgence in 2023, largely driven by gains in tech and semiconductor stocks, which comprise a significant portion of its portfolio. Technical analysis suggests a potential bullish breakout for SPY, with indicators pointing to an upcoming rally. Investors are advised to watch support levels and anticipate a rise leveraging the strength of its underlying tech holdings.",Kartik Dhankani,financial_markets|technology|economy_macro,0.7910559999999999,0.361118,Bullish,1.0,0.492747,Bullish
SPY,2023-04-09 02:04:37+00:00,TMW: the integral and beyond,https://www.theworldfolio.com/news/tmw-the-integral-and-beyond/4637/,The Worldfolio,The Worldfolio,"TMW, founded in 1949, is a Japanese specialist in plastic-injection molds for automobile parts, serving major vehicle manufacturers globally. The company emphasizes partnerships and maintains a global network to stay competitive. TMW is adapting to the automotive industry's shift towards EVs and FCVs, anticipating changes in design complexity rather than a fundamental alteration of its core business.",,manufacturing|energy_transportation,0.812555,0.232672,Somewhat-Bullish,0.34138,0.030379,Neutral
SPY,2023-05-25 01:12:06+00:00,Building a new sustainable foundation,https://www.theworldfolio.com/news/building-new-sustainable-foundation-/4686/,The Worldfolio,The Worldfolio,"Ishihara Co., Ltd., a trading company, supports the construction industry by focusing on efficiency, sustainability, and automation. The company leverages factory-based pre-cutting of gypsum boards to eliminate waste at construction sites and introduces new technologies like robotics to address labor shortages. Ishihara also launched a new housing brand, Fularika, to combine its various construction-related divisions into one comprehensive service, with future plans to expand internationally.",,real_estate|manufacturing|technology,0.7557986666666666,0.192176,Somewhat-Bullish,0.34945,0.035086,Neutral
SPY,2023-07-27 23:33:17+00:00,Small Account Options Trading: How to Scale,https://www.tastylive.com/news-insights/scaling-up-in-small-accounts,tastylive,tastylive,"This article discusses strategies for scaling up trading capital in small accounts, focusing on options trading. It explores two primary approaches: increasing an individual position's risk/buying power requirement or increasing the number of contracts, while emphasizing the importance of understanding risk and probability of loss. The author advises widening the spread while keeping the number of contracts low to balance premium and risk, ensuring sustainable growth rather than just profitability.",Kai Zeng,financial_markets,0.90422,0.116729,Neutral,1.0,0.110906,Neutral
SPY,2023-09-22 21:58:17+00:00,Exchange Traded Fund (ETF) Definition,https://coinmarketcap.com/academy/glossary/exchange-traded-fund-etf,CoinMarketCap,CoinMarketCap,"An Exchange Traded Fund (ETF) is a security that tracks a basket of assets like stocks, bonds, and cryptocurrencies, trading like a single stock on an exchange. ETFs offer diversification and generally lower costs compared to mutual funds, while also providing tax advantages and the ability to engage in short selling. They can be passively managed, tracking market indices, or actively managed by portfolio managers.",,financial_markets|finance|blockchain,0.8245986666666667,0.003882,Neutral,0.328545,0.005707,Neutral
SPY,2023-10-02 21:07:23+00:00,Economic Growth: The Role of Consumer Consumption and Confidence,https://www.etftrends.com/innovative-etfs-content-hub/economic-growth-role-consumer-consumption-confidence/,ETF Trends,ETF Trends,"The article discusses key economic releases from late September 2023, focusing on personal consumption expenditures (PCE), gross domestic product (GDP), and consumer confidence. It highlights that while GDP growth slowed but remained positive, core PCE showed signs of cooling, suggesting a potential end to Fed rate hikes. However, consumer confidence significantly declined due to rising prices and interest rates, raising concerns about future economic conditions.",Jennifer Nash,economy_macro|financial_markets|economy_monetary,0.8164036666666666,0.021559,Neutral,0.345838,0.00131,Neutral
SPY,2023-10-18 21:07:23+00:00,Volatility: Treasury Bonds Fluctuating Even More Than Stocks,https://www.ai-cio.com/news/volatility-treasury-bonds-fluctuating-even-more-than-stocks/,Chief Investment Officer,Chief Investment Officer,"Treasury bonds are experiencing unusual volatility, surpassing that of the S&P 500, according to Bespoke Investment Group. This elevated fluctuation, with daily swings of around 1% for long-term Treasury ETFs, has persisted despite a general decline in market volatility this year. Factors contributing to this trend include the Federal Reserve's interest rate hikes, increased government debt issuance, and Treasurys' role as a refuge investment.",Larry Light,financial_markets|economy_monetary|economy_macro,0.8222823333333333,0.01572,Neutral,0.319121,0.038455,Neutral
SPY,2023-11-27 20:17:17+00:00,AI-Driven Market Analysis: Revolutionizing Financial Insights for AMEX:SPY by JS_TechTrading,https://www.tradingview.com/chart/SPY/V9OQ3yrL-AI-Driven-Market-Analysis-Revolutionizing-Financial-Insights/,TradingView,TradingView,"This article explores how Artificial Intelligence (AI) is transforming market analysis, moving from traditional methods to advanced AI integration. It details various AI models used, such as neural networks and NLP, and their applications in predictive analytics, real-time data processing, automated technical analysis, and sentiment analysis for AMEX:SPY. The text also highlights real-world success stories and discusses future trends and shifts in AI's role in financial market decision-making.",JS_TechTrading,financial_markets|technology,0.856618,0.455564,Bullish,1.0,0.484828,Bullish
SPY,2023-12-09 19:25:37+00:00,Shinichi Ata,https://www.theworldfolio.com/leader/shinichi-ata/410/,The Worldfolio,The Worldfolio,"This article provides a leadership profile for Shinichi Ata, President & CEO of SB Technology Corp. It details his extensive career background, including key roles at Microsoft and SoftBank, and outlines his current goals for SB Technology, focusing on significant growth, technological advancement, and fostering employee engagement to contribute to the Information Revolution.",,technology,0.830649,0.171739,Somewhat-Bullish,0.319549,0.013945,Neutral
SPY,2024-02-23 06:52:00+00:00,SPY ETF Reaches Record High Amid Nvidia-Fueled AI Rally—Key Chart Pattern to Watch,https://www.investopedia.com/spy-etf-reaches-record-high-amid-nvidia-fueled-ai-rally-key-chart-pattern-to-watch-8599112,Investopedia,Investopedia,"The SPDR S&P 500 ETF Trust (SPY) reached a record high, mirroring the S&P 500's surge driven by mega-cap technology stocks, particularly after Nvidia's strong earnings report. Nvidia, along with other AI-related companies like Microsoft and Broadcom, contributed significantly to the rally, highlighting the outsized influence of Magnificent Seven stocks within the SPY's portfolio. Investors should watch the SPY's rising wedge pattern for potential breakouts or breakdowns, which could signal future price movements.",Timothy Smith,earnings|financial_markets|technology,0.9169863333333333,0.371895,Bullish,1.0,0.463896,Bullish
SPY,2024-03-01 16:33:46+00:00,Citadel's Ken Griffin Oversees $500 Billion in Managed Assets: These Are His Top 5 Holdings,https://www.theglobeandmail.com/investing/markets/stocks/AMD/pressreleases/24470375/citadels-ken-griffin-oversees-500-billion-in-managed-assets-these-are-his-top-5-holdings/,The Globe and Mail,The Globe and Mail,"Ken Griffin's Citadel Advisors manages $500 billion in assets and is a top-performing hedge fund. SEC filings reveal its top non-derivative holdings, which include the SPDR S&P 500 ETF Trust, Nvidia, Microsoft, Amazon, and Advanced Micro Devices. These investments highlight a strategy of betting on market indexes and major players in tech and AI while acknowledging potential risks and sector trends.",Motley Fool,financial_markets|technology|economy_macro|finance,0.751722,0.437871,Bullish,1.0,0.435849,Bullish
SPY,2024-03-19 16:33:47+00:00,Can you beat the market with Modern Portfolio Theory?,https://medium.datadriveninvestor.com/can-you-beat-the-market-with-modern-portfolio-theory-102dc6d03915,DataDrivenInvestor,DataDrivenInvestor,"This article explores Modern Portfolio Theory (MPT) and its application in portfolio management using Python. It discusses how MPT, developed by Harry Markowitz, aims to maximize returns for a given level of risk by optimizing capital allocation. The author promises a walkthrough on backtesting an MPT approach against a benchmark to assess its effectiveness.",Jacob Ingle,finance|financial_markets,0.887424,0.153756,Somewhat-Bullish,0.709179,0.218111,Somewhat-Bullish
