ticker,time_published,title,url,source,source_domain,summary,authors,topic_names,topic_relevance_mean,overall_sentiment_score,overall_sentiment_label,ticker_relevance_score,ticker_sentiment_score,ticker_sentiment_label
SPY,2024-03-21 16:33:46+00:00,The Most Popular ETF for Tracking the S&P 500,https://global.morningstar.com/en-ca/etfs/the-most-popular-etf-for-tracking-the-s-p-500,Morningstar Canada,Morningstar Canada,"The SPDR S&P 500 ETF Trust (SPY) is highlighted as the most popular and effective ETF for tracking the S&P 500, earning a Morningstar Medalist Rating of Silver. Its success is attributed to a rock-bottom fee and a well-diversified, market-cap-weighted portfolio that accurately represents the U.S. large-cap market. While market-cap weighting can lead to concentration risks, the ETF's broad diversification and low costs generally lead to sound long-term performance.",Mo'ath Almahasneh,financial_markets|finance|economy_macro,0.7581916666666667,0.331751,Somewhat-Bullish,1.0,0.315885,Somewhat-Bullish
SPY,2024-05-06 14:15:36+00:00,"The Biggest Investors Are Selling Stocks Right Now, Yet S&P 500 Notches Best 3-Day Streak In 7 Months - Should You Buy?",https://www.tradingview.com/news/benzinga:d5cabd000094b:0-the-biggest-investors-are-selling-stocks-right-now-yet-s-p-500-notches-best-3-day-streak-in-7-months-should-you-buy/,TradingView,TradingView,"Major U.S. pension funds, including CalPERS and the New York State Common Retirement Fund, are significantly reducing their equity allocations in favor of private equity and real estate. This strategic shift comes despite the S&P 500 experiencing a robust rebound in early May, driven by the Federal Reserve's dovish stance on interest rates and a cooler-than-expected jobs report. The S&P 500 recently achieved its strongest three-day winning streak since November 2023, recovering from a challenging April.",,financial_markets|economy_monetary|economy_macro|real_estate|finance,0.7335644,0.412564,Bullish,1.0,0.446256,Bullish
SPY,2024-05-16 14:15:36+00:00,Stock Market Recap: The Power of the 23-Month Moving Average,https://www.seeitmarket.com/stock-market-recap-the-power-of-the-23-month-moving-average/,See It Market,See It Market,"This article examines the significance of the 23-month moving average in stock market analysis, focusing on the S&P 500 (SPY), Alibaba, and the KRE regional banking ETF. It highlights how SPY's performance relative to its 23-month MA indicates an expansion phase, while Alibaba's struggle below it suggests caution. The analysis also points to KRE's potential for expansion if it can sustainably cross its 23-month MA.",Michele Schneider,financial_markets|finance,0.8341894999999999,0.402009,Bullish,1.0,0.419869,Bullish
SPY,2024-05-30 12:18:00+00:00,"Index values for Dow, S&P 500 are working again after hourlong freeze",https://www.cnbc.com/2024/05/30/ddata-feed-issue-cause-halt-in-calculations-for-dow-sp-500-indexes-as-trading-appears-normal.html,CNBC,CNBC,"The data feeds for key market averages, including the S&P 500 and Dow Jones Industrial Average, experienced an hour-long freeze on Thursday morning. The issue, confirmed by CME Group, affected the calculation of index values but did not disrupt individual stock trading or futures markets. The calculations froze around 10:41 AM ET and resumed shortly before noon.",Jesse Pound,financial_markets,0.93875,0.013487,Neutral,0.315645,0.008609,Neutral
SPY,2024-06-10 13:21:02+00:00,Exploring Economic Indicators: May 2024 Employment Shows Mixed Signals,https://www.etftrends.com/innovative-etfs-content-hub/exploring-economic-indicators-may-2024-employment-shows-mixed-signals/,ETF Trends,ETF Trends,"The May 2024 employment reports presented mixed signals for the U.S. labor market, with the official Employment Report showing more jobs added than expected but the unemployment rate rising. Concurrently, the JOLTS report indicated a cooling labor market with job openings falling, while the ADP Employment Report revealed lower-than-projected private sector job additions. These varied indicators reinforce expectations that the Federal Reserve will likely keep interest rates steady at its upcoming meeting.",Jennifer Nash,economy_macro|economy_monetary|financial_markets,0.8267536666666667,0.004019,Neutral,0.312549,0.025787,Neutral
SPY,2024-07-02 00:00:00+00:00,SPY vs. VOO: Which of Warren Buffett’s ETFs Is Better?,https://www.morningstar.com/funds/spy-vs-voo-which-warren-buffetts-etfs-is-better,Morningstar,Morningstar,"This article compares two S&P 500 tracking ETFs, SPY and VOO, both of which were previously held by Berkshire Hathaway. While both funds are highly rated and track the same index, VOO is identified as the better option due to its lower expense ratio and more efficient structure compared to SPY's unit investment trust limitations. The analysis highlights Morningstar's ""Gold"" rating for VOO versus ""Silver"" for SPY, emphasizing the importance of fees and structural efficiency for long-term investor benefit.",Margaret Giles,financial_markets|finance,0.8357175,0.205582,Somewhat-Bullish,1.0,0.208265,Somewhat-Bullish
SPY,2024-08-05 11:26:19+00:00,Market Sell-Off? This Active Equity ETF Is Still Outperforming,https://www.etftrends.com/active-etf-channel/market-selloff-active-equity-etf-still-outperforming/,ETF Trends,ETF Trends,"Amidst a recent market sell-off, the T. Rowe Price Capital Appreciation Equity ETF (TCAF) has demonstrated outperformance against the SPDR S&P 500 ETF Trust (SPY) over both the last three months and the past month. TCAF, an active equity ETF, attributes its success to fundamental analysis and the flexibility inherent in its active management approach, allowing it to adapt better to market volatility compared to index funds. It has also outperformed its ETF Database Category and FactSet Segment averages.",Nick Peters-Golden,financial_markets,0.916582,-0.321192,Somewhat-Bearish,1.0,-0.333343,Somewhat-Bearish
SPY,2024-09-20 10:34:54+00:00,SPY's Big Outflows Hamper State Street: Morningstar,https://www.etf.com/sections/news/spys-big-outflows-hamper-state-street-morningstar,ETF.com,ETF.com,"State Street Global Advisors (SSGA), the third-largest ETF issuer, is facing significant challenges this year due to substantial outflows from its flagship SPDR S&P 500 ETF Trust (SPY). SPY has bled $26.9 billion in net outflows, impacting SSGA's overall flow figures and widening the gap with larger competitors BlackRock and Vanguard. While Morningstar reports SSGA is on track for its worst year of ETF flows since 2018, State Street disputes the data, citing seasonal and structural factors that typically lead to strong year-end inflows for SPY.",Jeff Benjamin,finance|financial_markets,0.893057,-0.150339,Somewhat-Bearish,1.0,-0.239698,Somewhat-Bearish
SPY,2024-10-18 00:00:00+00:00,SPY Becomes First ETF to Reach $600 Billion in AUM,https://www.etftrends.com/spy-becomes-first-etf-reach-600-billion-aum/,ETF Trends,ETF Trends,"The SPDR S&P 500 ETF Trust (SPY) has become the first ETF to surpass $600 billion in assets under management, reaching $603 billion as of October 17, 2024. This milestone follows over $7 billion in inflows this week and highlights SPY's legacy as the first U.S. ETF and its continued appeal to investors for broad S&P 500 exposure. The fund's success is attributed to market-based drivers, technical and momentum factors during a recent rally, and its unheralded liquidity and optionality.",Nick Wodeshick,financial_markets|finance,0.8782015,0.814926,Bullish,1.0,0.844279,Bullish
SPY,2024-11-27 10:46:00+00:00,The S&P 500 (SPY) Is Ready for a Sell-Off,https://247wallst.com/investing/2024/11/27/the-sp-500-spy-is-ready-for-a-sell-off/,24/7 Wall St.,24/7 Wall St.,"The S&P 500 has gained 25% year-to-date, but this growth is largely driven by a small group of ""Magnificent 7"" stocks, pushing valuations above historical averages. While the SPDR S&P 500 ETF Trust (SPY) is generally recommended for long-term investors due to the market's historical resilience, the current concentration of gains suggests a potential sell-off is due. Despite this, experts advise against shorting the market and suggest that consistently investing in SPY can still lead to long-term gains, as bear markets are typically short-lived and followed by stronger bull markets.",Rich Duprey,financial_markets|technology|economy_macro|finance,0.77463325,0.108958,Neutral,1.0,-0.093826,Neutral
